{
  "approval_id": "APPR-0002",
  "timestamp": "2026-05-08T10:00:00Z",
  "approval_type": "nemawashi-major",
  "status": "approved",
  "requested_by_agent": "orchestrator",
  "sprint_context": 2,
  "description": "Approve major scope change: integration-signal schema expanded to include taxonomy_version field.",
  "linked_decision_id": "DEC-0002",
  "linked_henka_id": "HK-0002",
  "position_paper_path": ".council/nemawashi/DEC-0002.md",
  "effective_autonomy_at_request": 4
}
